{
  "schema_id": "aetheln.runtime-asset-intake",
  "schema_version": 1,
  "policy_schema_id": "aetheln.asset-intake-policy",
  "policy_schema_version": 2,
  "content_root": "Content/",
  "package_root": "/Game",
  "expected_asset_count": 51,
  "source_groups": [
    {
      "id": "issue-13-starter-map",
      "author_or_provider": "Aetheln Online repository contributors through Issue #13",
      "source_record": "Issue #13 approved bootstrap record and docs/unreal-project-setup.md",
      "source_version": "3ba4608e197ae4bf79ef1e4cd0bb0cb28f0adc86",
      "license_or_permission_evidence": "Repository-owner-authorized original bootstrap asset; the approved blank project used no Starter Content",
      "modifications": "StarterMap was authored in the pinned Unreal Editor for the blank C++ bootstrap",
      "generation_metadata_when_applicable": "not_applicable",
      "reviewer": "Repository owner via Issue #13",
      "approval_state": "temporary_prototype_only",
      "naming_owner": "Issue #13",
      "import_settings_record": "not_applicable: repository-authored map; creation is recorded by Issue #13",
      "reimport_settings_record": "not_applicable: preserve the reviewed map and treat any Editor save as a new reviewed content version"
    },
    {
      "id": "issue-100-epic-character-template",
      "author_or_provider": "Epic Games template content provider; individual authorship is not inferred",
      "source_record": "Issue #100 one-time exception and docs/movement-poc.md#pinned-source-and-migration",
      "source_version": "Unreal Engine 5.8.1-release at 71fe36aac5a8df5ccd66c763ffc902b29b6a9c43; Templates/TemplateResources/High/Characters/Content",
      "license_or_permission_evidence": "Issue #100 records repository-owner permission for this exact one-time temporary closure; this registry makes no independent license conclusion",
      "modifications": "Unreal Asset Tools migration save into the documented 39-package character closure; Issue #120 owner decision 2026-10-05 (option C): CR_Mannequin_FootIK re-saved once in the pinned Unreal 5.8.1 Editor with only PreviewSkeletalMesh changed from the excluded SKM_Manny_Simple to the governed SKM_Quinn_Simple; its imports, export table, and thumbnail are unchanged, and its content version stays 1 because the preview mesh is editor-only",
      "generation_metadata_when_applicable": "not_applicable",
      "reviewer": "Repository owner via Issue #100",
      "approval_state": "temporary_prototype_only",
      "naming_owner": "Issue #100",
      "import_settings_record": "docs/movement-poc.md#pinned-source-and-migration and scripts/build_movement_poc.py at 1ab315e0749cf6114572827736b36798e1a100b5",
      "reimport_settings_record": "Rerun only the documented pinned migration helper, preserve the reviewed packages, and review every resulting hash as a new content version"
    },
    {
      "id": "issue-100-epic-level-prototyping-template",
      "author_or_provider": "Epic Games template content provider; individual authorship is not inferred",
      "source_record": "Issue #100 one-time exception and docs/movement-poc.md#pinned-source-and-migration",
      "source_version": "Unreal Engine 5.8.1-release at 71fe36aac5a8df5ccd66c763ffc902b29b6a9c43; Templates/TemplateResources/High/LevelPrototyping/Content",
      "license_or_permission_evidence": "Issue #100 records repository-owner permission for this exact one-time temporary closure; this registry makes no independent license conclusion",
      "modifications": "Unreal Asset Tools migration save into the documented six-package Level Prototyping closure",
      "generation_metadata_when_applicable": "not_applicable",
      "reviewer": "Repository owner via Issue #100",
      "approval_state": "temporary_prototype_only",
      "naming_owner": "Issue #100",
      "import_settings_record": "docs/movement-poc.md#pinned-source-and-migration and scripts/build_movement_poc.py at 1ab315e0749cf6114572827736b36798e1a100b5",
      "reimport_settings_record": "Rerun only the documented pinned migration helper, preserve the reviewed packages, and review every resulting hash as a new content version"
    },
    {
      "id": "issue-100-repository-authored-poc",
      "author_or_provider": "Aetheln Online repository contributors through Issue #100",
      "source_record": "Issue #100 and docs/movement-poc.md#runtime-composition",
      "source_version": "1ab315e0749cf6114572827736b36798e1a100b5",
      "license_or_permission_evidence": "Repository owner authorized the bounded Issue #100 local POC; no production-content approval is recorded",
      "modifications": "Repository-authored POC map and Blueprint assets created from the approved blank project and governed temporary template inputs. Content version 2 of MovementPOC (Issue #83 P4) adds one navigation bounds volume, one built static RecastNavMesh, and one greybox enemy, authored headless by the AethelnPrototypeSpaceAuthoring commandlet under the LFS lock on the map",
      "generation_metadata_when_applicable": "scripts/build_movement_poc.py at 1ab315e0749cf6114572827736b36798e1a100b5 using Unreal 5.8.1 Asset Tools",
      "reviewer": "Repository owner via Issue #100",
      "approval_state": "temporary_prototype_only",
      "naming_owner": "Issue #100",
      "import_settings_record": "docs/movement-poc.md#runtime-composition and scripts/build_movement_poc.py at 1ab315e0749cf6114572827736b36798e1a100b5",
      "reimport_settings_record": "Rerun the pinned authoring helper outside the repository, preserve reviewed packages, and review every resulting hash as a new content version"
    },
    {
      "id": "issue-100-template-derived-poc-animation",
      "author_or_provider": "Epic Games template content provider; Aetheln Online repository contributors authored the Issue #100 POC derivatives",
      "source_record": "Issue #100 and docs/movement-poc.md#runtime-composition",
      "source_version": "1ab315e0749cf6114572827736b36798e1a100b5 based on Unreal Engine 5.8.1-release template content",
      "license_or_permission_evidence": "Issue #100 records permission for the exact temporary source closure and bounded POC derivatives; this registry makes no independent license conclusion",
      "modifications": "POC-only locomotion animation Blueprint and BlendSpace derivatives described in docs/movement-poc.md",
      "generation_metadata_when_applicable": "scripts/build_movement_poc.py at 1ab315e0749cf6114572827736b36798e1a100b5 using Unreal 5.8.1 Asset Tools",
      "reviewer": "Repository owner via Issue #100",
      "approval_state": "temporary_prototype_only",
      "naming_owner": "Issue #100",
      "import_settings_record": "docs/movement-poc.md#runtime-composition and scripts/build_movement_poc.py at 1ab315e0749cf6114572827736b36798e1a100b5",
      "reimport_settings_record": "Rerun the pinned derivative-authoring helper, preserve reviewed packages, and review every resulting hash as a new content version"
    }
  ],
  "assets": [
    { "asset_path": "/Game/Characters/Mannequins/Anims/Unarmed/ABP_Unarmed", "repository_path": "Content/Characters/Mannequins/Anims/Unarmed/ABP_Unarmed.uasset", "stable_id": "content.runtime.characters.mannequins.anims.unarmed.abp_unarmed", "content_version": 1, "audience": "client_only", "lifecycle_state": "temporary_prototype", "source_group_id": "issue-100-epic-character-template", "content_sha256": "6fb4eb0ff01a5036222412f77ee8d1464a2ac41d4a6add244d7be54b8ab7d439", "lifecycle_evidence": { "content_identity": { "stable_id": "content.runtime.characters.mannequins.anims.unarmed.abp_unarmed", "content_version": 1, "content_sha256": "6fb4eb0ff01a5036222412f77ee8d1464a2ac41d4a6add244d7be54b8ab7d439" }, "temporary_prototype": [{ "owner": "Issue #100", "approval_record": "Issue #100 one-time exception; temporary local POC use only, not production approval", "recovery_trigger": "Remove or replace when the owning movement or content ticket supersedes Issue #100's one-time prototype exception", "may_be_runtime_candidate": false }], "runtime_candidate": [], "production_approval": [] } },
    { "asset_path": "/Game/Characters/Mannequins/Anims/Unarmed/BS_Idle_Walk_Run", "repository_path": "Content/Characters/Mannequins/Anims/Unarmed/BS_Idle_Walk_Run.uasset", "stable_id": "content.runtime.characters.mannequins.anims.unarmed.bs_idle_walk_run", "content_version": 1, "audience": "client_only", "lifecycle_state": "temporary_prototype", "source_group_id": "issue-100-epic-character-template", "content_sha256": "af678450e8691c5e5482efd680af9e6d3c2b4603758223166076fae67b3e6b00", "lifecycle_evidence": { "content_identity": { "stable_id": "content.runtime.characters.mannequins.anims.unarmed.bs_idle_walk_run", "content_version": 1, "content_sha256": "af678450e8691c5e5482efd680af9e6d3c2b4603758223166076fae67b3e6b00" }, "temporary_prototype": [{ "owner": "Issue #100", "approval_record": "Issue #100 one-time exception; temporary local POC use only, not production approval", "recovery_trigger": "Remove or replace when the owning movement or content ticket supersedes Issue #100's one-time prototype exception", "may_be_runtime_candidate": false }], "runtime_candidate": [], "production_approval": [] } },